{
  "schema_version": "1.0",
  "gateway_id": "gw-001",
  "site_id": "site-001",
  "state": "online",
  "boot_id": "b7f3a91c",
  "sequence": 0,
  "published_at": "2026-10-09T08:00:00Z",
  "link": { "type": "wifi", "rssi_dbm": -61 },
  "uptime_s": 4,
  "buffered_messages": 0,
  "firmware_version": "0.1.0"
}
